{
  "meta": {
    "ticker": "SCOA",
    "name": "Sample Coal Co (SYNTHETIC)",
    "subIndustry": "SYN-COAL",
    "chainStage": "stage-extraction",
    "pair": [
      "XCOA"
    ],
    "version": "SCOA-2025Q4-r1-SYNTHETIC",
    "contentHash": "8ba8ec7547b2cd639bdb087634fc9fedfa9932576ac4c6defa431a7173113678",
    "asOf": {
      "latestQuarter": "25Q4",
      "fullStatementsTo": "25Q4"
    },
    "provenance": "synthetic",
    "status": "published",
    "depth": "foundation",
    "conditionIds": [
      3
    ],
    "skillVersions": {
      "fs-intake": "0.0.0-SYNTHETIC",
      "fs-driver-decomposition": "0.0.0-SYNTHETIC",
      "financial-modeling": "0.0.0-SYNTHETIC"
    },
    "rounding": {
      "decimals": 0
    },
    "conditionNotes": {
      "3": "This model supplies the per-tonne economics the rule needs: realised price, cost per tonne and margin through the cycle."
    }
  },
  "periods": [
    {
      "id": "24Q1",
      "label": "Q1 24",
      "kind": "quarter",
      "forecast": false
    },
    {
      "id": "24Q2",
      "label": "Q2 24",
      "kind": "quarter",
      "forecast": false
    },
    {
      "id": "24Q3",
      "label": "Q3 24",
      "kind": "quarter",
      "forecast": false
    },
    {
      "id": "24Q4",
      "label": "Q4 24",
      "kind": "quarter",
      "forecast": false
    },
    {
      "id": "25Q1",
      "label": "Q1 25",
      "kind": "quarter",
      "forecast": false
    },
    {
      "id": "25Q2",
      "label": "Q2 25",
      "kind": "quarter",
      "forecast": false
    },
    {
      "id": "25Q3",
      "label": "Q3 25",
      "kind": "quarter",
      "forecast": false
    },
    {
      "id": "25Q4",
      "label": "Q4 25",
      "kind": "quarter",
      "forecast": false
    },
    {
      "id": "FY25",
      "label": "FY 25",
      "kind": "fy",
      "forecast": false
    },
    {
      "id": "26Q1E",
      "label": "Q1 26E",
      "kind": "quarter",
      "forecast": true
    },
    {
      "id": "26Q2E",
      "label": "Q2 26E",
      "kind": "quarter",
      "forecast": true
    }
  ],
  "sheets": [
    {
      "id": "reported",
      "rows": [
        {
          "id": "revenue",
          "label": "Revenue",
          "unit": "Rp bn",
          "cells": [
            {
              "value": 850,
              "kind": "sourced",
              "source": {
                "issuer": "Sample Coal Co (SYNTHETIC)",
                "document": "SYNTHETIC interim financial statements Q1 24",
                "period": "Q1 24",
                "page": 12,
                "note": "24",
                "xbrlConcept": "syn:Revenue"
              }
            },
            {
              "value": 935,
              "kind": "sourced",
              "source": {
                "issuer": "Sample Coal Co (SYNTHETIC)",
                "document": "SYNTHETIC interim financial statements Q2 24",
                "period": "Q2 24",
                "page": 12,
                "note": "24",
                "xbrlConcept": "syn:Revenue"
              }
            },
            {
              "value": 960,
              "kind": "sourced",
              "source": {
                "issuer": "Sample Coal Co (SYNTHETIC)",
                "document": "SYNTHETIC interim financial statements Q3 24",
                "period": "Q3 24",
                "page": 12,
                "note": "24",
                "xbrlConcept": "syn:Revenue"
              }
            },
            {
              "value": 960,
              "kind": "sourced",
              "source": {
                "issuer": "Sample Coal Co (SYNTHETIC)",
                "document": "SYNTHETIC interim financial statements Q4 24",
                "period": "Q4 24",
                "page": 12,
                "note": "24",
                "xbrlConcept": "syn:Revenue"
              }
            },
            {
              "value": 836,
              "kind": "sourced",
              "source": {
                "issuer": "Sample Coal Co (SYNTHETIC)",
                "document": "SYNTHETIC interim financial statements Q1 25",
                "period": "Q1 25",
                "page": 12,
                "note": "24",
                "xbrlConcept": "syn:Revenue"
              }
            },
            {
              "value": 912,
              "kind": "sourced",
              "source": {
                "issuer": "Sample Coal Co (SYNTHETIC)",
                "document": "SYNTHETIC interim financial statements Q2 25",
                "period": "Q2 25",
                "page": 12,
                "note": "24",
                "xbrlConcept": "syn:Revenue"
              }
            },
            {
              "value": 1040,
              "kind": "sourced",
              "source": {
                "issuer": "Sample Coal Co (SYNTHETIC)",
                "document": "SYNTHETIC interim financial statements Q3 25",
                "period": "Q3 25",
                "page": 12,
                "note": "24",
                "xbrlConcept": "syn:Revenue"
              }
            },
            {
              "value": 1120,
              "kind": "sourced",
              "source": {
                "issuer": "Sample Coal Co (SYNTHETIC)",
                "document": "SYNTHETIC interim financial statements Q4 25",
                "period": "Q4 25",
                "page": 12,
                "note": "24",
                "xbrlConcept": "syn:Revenue"
              }
            },
            {
              "value": 3908,
              "kind": "sourced",
              "source": {
                "issuer": "Sample Coal Co (SYNTHETIC)",
                "document": "SYNTHETIC annual report FY 25",
                "period": "FY 25",
                "page": 12,
                "note": "24",
                "xbrlConcept": "syn:Revenue"
              },
              "tieOut": {
                "externalValue": 3908,
                "sourceText": "SYNTHETIC IDX XBRL instance FY 25, syn:Revenue",
                "difference": 0,
                "status": "agrees"
              }
            },
            {
              "value": null,
              "kind": "missing",
              "note": "Forecast period: nothing is reported yet (SYNTHETIC)"
            },
            {
              "value": null,
              "kind": "missing",
              "note": "Forecast period: nothing is reported yet (SYNTHETIC)"
            }
          ]
        },
        {
          "id": "vol_sold",
          "label": "Coal sales volume",
          "unit": "Mt",
          "cells": [
            {
              "value": 1,
              "kind": "sourced",
              "source": {
                "issuer": "Sample Coal Co (SYNTHETIC)",
                "document": "SYNTHETIC quarterly operating update Q1 24",
                "period": "Q1 24",
                "page": 3
              }
            },
            {
              "value": 1.1,
              "kind": "sourced",
              "source": {
                "issuer": "Sample Coal Co (SYNTHETIC)",
                "document": "SYNTHETIC quarterly operating update Q2 24",
                "period": "Q2 24",
                "page": 3
              }
            },
            {
              "value": 1.2,
              "kind": "sourced",
              "source": {
                "issuer": "Sample Coal Co (SYNTHETIC)",
                "document": "SYNTHETIC quarterly operating update Q3 24",
                "period": "Q3 24",
                "page": 3
              }
            },
            {
              "value": 1.2,
              "kind": "sourced",
              "source": {
                "issuer": "Sample Coal Co (SYNTHETIC)",
                "document": "SYNTHETIC quarterly operating update Q4 24",
                "period": "Q4 24",
                "page": 3
              }
            },
            {
              "value": 1.1,
              "kind": "sourced",
              "source": {
                "issuer": "Sample Coal Co (SYNTHETIC)",
                "document": "SYNTHETIC quarterly operating update Q1 25",
                "period": "Q1 25",
                "page": 3
              }
            },
            {
              "value": 1.2,
              "kind": "sourced",
              "source": {
                "issuer": "Sample Coal Co (SYNTHETIC)",
                "document": "SYNTHETIC quarterly operating update Q2 25",
                "period": "Q2 25",
                "page": 3
              }
            },
            {
              "value": 1.3,
              "kind": "sourced",
              "source": {
                "issuer": "Sample Coal Co (SYNTHETIC)",
                "document": "SYNTHETIC quarterly operating update Q3 25",
                "period": "Q3 25",
                "page": 3
              }
            },
            {
              "value": 1.4,
              "kind": "sourced",
              "source": {
                "issuer": "Sample Coal Co (SYNTHETIC)",
                "document": "SYNTHETIC quarterly operating update Q4 25",
                "period": "Q4 25",
                "page": 3
              }
            },
            {
              "value": 5,
              "kind": "formula",
              "formula": "=SUM(reported!G3:J3)"
            },
            {
              "value": null,
              "kind": "missing",
              "note": "Forecast period: nothing is reported yet (SYNTHETIC)"
            },
            {
              "value": null,
              "kind": "missing",
              "note": "Forecast period: nothing is reported yet (SYNTHETIC)"
            }
          ]
        },
        {
          "id": "production",
          "label": "Coal production",
          "unit": "Mt",
          "cells": [
            {
              "value": 1,
              "kind": "sourced",
              "source": {
                "issuer": "Sample Coal Co (SYNTHETIC)",
                "document": "SYNTHETIC quarterly operating update Q1 24",